{
  "$schema": "http://json-schema.org/draft-07/schema#",
  "type": "object",
  "properties": {
    "pipeline_metadata": {
      "type": "object",
      "properties": {
        "resume_content_hash": {
          "type": "string"
        },
        "created_at": {
          "type": "string",
          "format": "date-time"
        },
        "source": {
          "type": "string"
        }
      },
      "required": [
        "resume_content_hash"
      ]
    },
    "name": {
      "type": "string"
    },
    "email": {
      "type": "string",
      "format": "email"
    },
    "skills": {
      "type": "array",
      "items": {
        "type": "string"
      }
    },
    "experience": {
      "type": "array",
      "items": {
        "type": "object",
        "properties": {
          "title": {
            "type": "string"
          },
          "company": {
            "type": "string"
          },
          "start": {
            "type": "string"
          },
          "end": {
            "type": "string"
          },
          "description": {
            "type": "string"
          },
          "responsibilities": {
            "type": "array",
            "items": {
              "type": "string"
            }
          }
        },
        "required": [
          "title",
          "company"
        ]
      }
    },
    "projects": {
      "type": "array",
      "items": {
        "type": "object",
        "properties": {
          "name": {
            "type": "string"
          },
          "description": {
            "type": "string"
          },
          "technologies": {
            "type": "array",
            "items": {
              "type": "string"
            }
          }
        },
        "required": [
          "name"
        ]
      }
    },
    "education": {
      "type": "array",
      "items": {
        "type": "object",
        "properties": {
          "degree": {
            "type": "string"
          },
          "institution": {
            "type": "string"
          },
          "start_year": {
            "type": "string"
          },
          "end_year": {
            "type": "string"
          },
          "field_of_study": {
            "type": "string"
          },
          "cgpa": {
            "type": "string"
          },
          "institute_location": {
            "type": "string"
          }
        },
        "required": [
          "degree",
          "institution"
        ]
      }
    },
    "candidate_achievements": {
      "type": "array",
      "items": {
        "type": "string"
      }
    },
    "certifications": {
      "type": "array",
      "items": {
        "type": "string"
      }
    },
    "tools": {
      "type": "array",
      "items": {
        "type": "string"
      }
    },
    "technologies": {
      "type": "array",
      "items": {
        "type": "string"
      }
    },
    "salary_expectation": {
      "type": "object",
      "properties": {
        "value": {
          "type": "string"
        },
        "currency": {
          "type": "string"
        }
      }
    }
  },
  "required": [
    "name"
  ]
}